{
  "schema_version": "1.2",
  "artifact_type": "handoff",
  "run_id": "run-mcp-git-surface-mapper-h1s1-6",
  "produced_at": "2026-05-02T20:53:42Z",
  "produced_by": "cbm-baseline-handoff@0.1",
  "source_sha": "4503e2d12b79",
  "inputs": [
    {
      "path": ".research/run-mcp-git-surface-mapper-h1s1-6/surface-map.json",
      "sha256": "ff48b3d6efdcd49e62ef6b9b3590a07da5fd7e9a65872d3480e465e7a5fb36ae"
    },
    {
      "path": ".research/run-mcp-git-surface-mapper-h1s1-6/project-type.json",
      "sha256": "9a77bf06bd775fb9fbd3ea1edf5174d8f2e2cd008b8d38b675a3f8b85ff1b596"
    },
    {
      "path": ".research/run-mcp-git-surface-mapper-h1s1-6/goal-binding.json",
      "sha256": "ef2072641359765f96d77f9a277e27dc72bb96e108492e94266976c56654e1fa"
    },
    {
      "path": ".research/run-mcp-git-surface-mapper-h1s1-6/findings/int-0001.md",
      "sha256": "3b9fda0420d9773a60de59d5e2f4b5ee34da6b4419e77710f0344b47ba0a76c1"
    },
    {
      "path": ".research/run-mcp-git-surface-mapper-h1s1-6/skeptic-review/surface-map.md",
      "sha256": "b712df09c4cca95c8d452b1128328a353eceef3967f15ff3a7ba00e17b18e585"
    }
  ],
  "status": "draft",
  "coverage": {
    "scope": {
      "included_globs": [
        "**/*"
      ],
      "excluded_globs": [
        ".git/**",
        ".research/**",
        ".venv/**",
        "node_modules/**",
        "**/__pycache__/**",
        ".pytest_cache/**",
        ".DS_Store"
      ]
    },
    "result": {
      "files_in_scope": 12,
      "files_examined_directly": 1,
      "files_inspected_via_extractor": 12,
      "files_unread_in_scope": 11
    },
    "limitations": [
      "Phase A kernel records structure only; interpretive review remains a runtime-agent task."
    ]
  },
  "mode": "lightweight",
  "user_goal": "produce real Surface Mapper map for MCP git server surfaces",
  "goal_class": "understand_repo",
  "research_only": true,
  "gate_summary": {
    "schema_validation": {
      "passed": 6,
      "failed_artifacts": []
    },
    "citation_resolution": {
      "resolved": 28,
      "unresolved_count": 0,
      "unresolved_examples": []
    },
    "ledger_consistency": {
      "append_only_verified": true,
      "entry_count": 30,
      "missing_citation_count": 0,
      "missing_citation_examples": []
    },
    "staleness_check": {
      "fresh": 5,
      "stale_artifacts": []
    },
    "skeptic_review": {
      "artifacts_reviewed": 1,
      "challenges_logged": 0,
      "challenges_resolved": 0
    }
  },
  "contestation_summary": {
    "claims_by_register": {
      "factual": 11,
      "inferential": 2,
      "interpretive": 2
    },
    "claims_by_status": {
      "active": 15,
      "challenged": 0,
      "contested": 0,
      "contradicted": 0,
      "superseded": 0,
      "retired": 0
    },
    "open_challenges": 0,
    "contested_claims": [],
    "contradicted_claims": []
  },
  "artifacts": [
    {
      "path": ".research/run-mcp-git-surface-mapper-h1s1-6/codebase-map.json",
      "artifact_type": "codebase_map",
      "status": "draft",
      "summary": "Deterministic structural file inventory."
    },
    {
      "path": ".research/run-mcp-git-surface-mapper-h1s1-6/project-type.json",
      "artifact_type": "project_type_report",
      "status": "draft",
      "summary": "Phase 0 project-type detection report."
    },
    {
      "path": ".research/run-mcp-git-surface-mapper-h1s1-6/surface-map.json",
      "artifact_type": "surface_map",
      "status": "draft",
      "summary": "Draft deterministic surface map with explicit unknown dependency edge."
    },
    {
      "path": ".research/run-mcp-git-surface-mapper-h1s1-6/goal-binding.json",
      "artifact_type": "goal_binding",
      "status": "draft",
      "summary": "Goal-specific candidate binding over the surface map."
    },
    {
      "path": ".research/run-mcp-git-surface-mapper-h1s1-6/findings/int-0001.md",
      "artifact_type": "findings_card",
      "status": "draft",
      "summary": "Goal-bound structural findings card."
    },
    {
      "path": ".research/run-mcp-git-surface-mapper-h1s1-6/skeptic-review/surface-map.md",
      "artifact_type": "skeptic_review",
      "status": "draft",
      "summary": "Lightweight Skeptic finding against unknown dependency closure."
    }
  ],
  "open_questions_count": 1,
  "coverage_caveats": [
    "1 of 12 in-scope file(s) were directly examined for role claims; 11 file(s) remain unread by an agent or human.",
    "11 file(s) were inspected via deterministic extractors only; those observations support structural claims, not settled interpretive role claims.",
    "Phase A surface mapping is deterministic and has not performed language-level import/call extraction."
  ],
  "recommended_next_action": "Implement call and runtime workflow extraction so the unknown dependency edge can be narrowed with grounded relations."
}
